Product URL,Product Name,Product Price,Rating,Number of Reviews,ASIN,Description,Manufacturer
https://www.amazon.in/Gear-Expandable-RainCover-Grey-Black-TLPTURBO00401/dp/B097KDRZ67/ref=sr_1_52?crid=2M096C61O4MLT&keywords=bags&qid=1688660123&sprefix=ba%2Caps%2C283&sr=8-52,Gear Turbo 45L Expandable Water Resistant Antitheft Laptop Bag/Backpack/Briefcase For Men/Women With Raincover (Grey),"₹1,794",4.4,"1,016",B097KDRZ67," Care Instructions: Hand Wash Only Ergonomically Designed : Spacious with Multiple Compartments & Pockets : Expandable StorageIntuitive Access : Cushioned Back Panel & Shoulder Straps : Lightweight Load Stabilizing Adjustable Sternum Strap : Bartacked Load Points : Water Resistant Fabric : Heavy Duty Long Lasting Zippers Padded Velcro'ed Sleeve fits upto 15.6"" Laptop : Padded Base Outer material type: Polyester",Brand: Gear 
https://www.amazon.in/sspa/click?ie=UTF8&spc=MTo3NDI2MjIwNjgxNjkwMDA3OjE2ODg2NjAxMjM6c3BfYnRmOjMwMDAwNzE5MDEyMjYzMjo6MDo6&url=%2FRed-Lemon-Unisex-adult-Waterproof-Charging%2Fdp%2FB09VGNTJTN%2Fref%3Dsr_1_53_sspa%3Fcrid%3D2M096C61O4MLT%26keywords%3Dbags%26qid%3D1688660123%26sprefix%3Dba%252Caps%252C283%26sr%3D8-53-spons%26sp_csd%3Dd2lkZ2V0TmFtZT1zcF9idGY%26psc%3D1,Red Lemon Unisex-adult Bange Series Rhombus Shell Design Waterproof Sling Bag with USB Charging (Blue),"₹1,899",4.2,14,B09VGNTJTN," PREMIUM MATERIAL: This stylish chest bag is made of waterproof TPU material. Comes in a shell structure with a front Rhombus design. ORGANIZED DESIGN: Spaced compartment with one separate soft sleeve to hold iPad, phone, or notebook. Spacious enough to store accessories like a camera or short trip essentials. Multiple organized pockets to hold money wallet, power bank, mobile, charger, pens, cable, etc. Soft adjustable single shoulder strap to relieve the stress of shoulder. A strong sturdy handle to carry the bag with ease. USB FEATURE: External USB port with built-in charging cable enables convenient charging by connecting your power bank with your electronic devices. DIMENSIONS: 19 cms x 16 cms x 33 cms (LxWxH). The weight of the bag is 0.48 KG. Outer Material Type: Synthetic",Brand: Red Lemon 
https://www.amazon.in/sspa/click?ie=UTF8&spc=MTo3NDI2MjIwNjgxNjkwMDA3OjE2ODg2NjAxMjM6c3BfYnRmOjIwMTUzNTUyNzQyNzk4OjowOjo&url=%2FWALKENT-Bagpack-Waterproof-Function-Pockets%2Fdp%2FB09BVWXBFG%2Fref%3Dsr_1_54_sspa%3Fcrid%3D2M096C61O4MLT%26keywords%3Dbags%26qid%3D1688660123%26sprefix%3Dba%252Caps%252C283%26sr%3D8-54-spons%26sp_csd%3Dd2lkZ2V0TmFtZT1zcF9idGY%26psc%3D1,"ARCTIC HUNTER 15.6"" Laptop Bag (Model Aura) Two Side Bottle Pocket, Waterproof, Multi-Function Pockets for Office College Men Women","₹3,590",4.4,61,B09BVWXBFG," Original Arctic Hunter Aura Laptop Backpack is a versatile accessory designed for modern professionals and students alike, offering a stylish and practical solution to carrying your laptop and other essentials Made with high-quality materials, the backpack features a water-resistant and scratch-resistant outer that keeps your belongings safe and dry, even in the toughest of weather conditions With multiple compartments, including a cushioned laptop compartment that is ideal for laptops up to 15.6 inches and a tablet compartment for devices up to 10.2 inches, the backpack provides ample space for all your daily essentials The backpack is designed for maximum comfort, with cushioned and padded shoulder straps and back that ensure you can carry your belongings with ease, even during extended periods of use Whether you need a reliable office bag or a durable backpack for college, the Arctic Hunter Aura Laptop Backpack is the perfect choice, offering a large storage capacity, anti-theft pockets, side bottle pockets, and an external USB port for added convenience",Brand: WALKENT 
https://www.amazon.in/sspa/click?ie=UTF8&spc=MTo1OTA5OTk1MjA2MTA4NjcwOjE2ODg2NjAxMjY6c3BfYXRmX25leHQ6MjAxNTczOTM3ODc2OTg6OjA6Og&url=%2FEUME-Black-Laptop-Backpack-2400012_AA_BuyMore%2Fdp%2FB07K1L7NJ8%2Fref%3Dsr_1_49_sspa%3Fcrid%3D2M096C61O4MLT%26keywords%3Dbags%26qid%3D1688660126%26sprefix%3Dba%252Caps%252C283%26sr%3D8-49-spons%26sp_csd%3Dd2lkZ2V0TmFtZT1zcF9hdGZfbmV4dA%26psc%3D1,"EUME Barret - 29L Massager Laptop Backpack Bag with Built In Patent Massager Technology with 15.6 Inch Laptop Compartment for Men & Women, Camouflage Black","₹4,599",4.0,97,B07K1L7NJ8," It has single compartments, with one exclusively padded for the laptop up to size 15.6 inches size. It also has 2 smaller zippered compartments for extra storage. Bag Volume, Weight and Size: 29 L; 1.59Kg; 48.26 X 31.75 X 11.43 cm. This backpack has 2 Sets of massagers for maximum relaxation of the upper and lower back can be powered using a Power Bank (10000 mAh recommended).This Backpack has an adjustable torso and can be custom adjusted to different heights for perfect placement of the massagers on upper and lower backs. This bag has an adjustable torso and can be custom adjusted to different heights for perfect placement of the massagers on upper and lower backs. Stylish look, ergonomic design, water resistant polyester material for long life. WARRANTY: 1 Year manufacturer warranty on manufacturing defects only.",Brand: EUME 
https://www.amazon.in/sspa/click?ie=UTF8&spc=MTo1OTA5OTk1MjA2MTA4NjcwOjE2ODg2NjAxMjY6c3BfYXRmX25leHQ6MjAxNDUzNTcxMDIyOTg6OjA6Og&url=%2Fuppercase-Professional-Anti-theft-resistant-sustainable%2Fdp%2FB0C1CBY2PJ%2Fref%3Dsr_1_50_sspa%3Fcrid%3D2M096C61O4MLT%26keywords%3Dbags%26qid%3D1688660126%26sprefix%3Dba%252Caps%252C283%26sr%3D8-50-spons%26sp_csd%3Dd2lkZ2V0TmFtZT1zcF9hdGZfbmV4dA%26psc%3D1,"uppercase Matrix Professional Anti-theft Laptop Backpack (15.6 Inch) 3x more water resistant sustainable bags with rain proof zippers for Men, Women, Boys and Girls, 750 Days warranty","₹2,300",4.2,42,B0C1CBY2PJ," Care Instructions: Wipe with Damp Cloth Handcrafted with care and made up of premium quality robust material Padded anti-theft laptop compartment fits up to 15.6"" Laptop and a tablet compartment; Zipper Pocket in front along with a slip In Pocket in front; Internal Organisers with a bottle holder on the side Wrinkle free bag and 3x more water resistant with Rainproof zippers; Trolley sleeve to securely place the bags on the luggage; Comfortable Padded shoulder straps GRS certified for sustainability; The GRS (Global Recycled Standard) is intended for use with any product that contains at least 50% Recycled Material (License No. CMPY-158596); 750 days of international warranty",Brand: uppercase 
https://www.amazon.in/Safari-Spartan-Water-Resistant-Backpack/dp/B09B277CR5/ref=sr_1_51?crid=2M096C61O4MLT&keywords=bags&qid=1688660126&sprefix=ba%2Caps%2C283&sr=8-51,"Safari Spartan 21 Ltrs Water Resistant Backpack - Teal, S (SPARTAN19CBTEA)",₹599,3.8,850,B09B277CR5, Lightweight yet durable backpack/daypack for school use or everyday outings Front storage pocket keeps smaller items neatly organized and easy to access Mesh pockets on both sides to accommodate your water bottle and umbrella Mesh Padding on back & shoulder strap to provide comfort & better back support; 1-year International Warranty against manufacturing defects Age Range Description: Adult; Closure Type: Zipper; Lining Description: Polyester,Brand: Safari 
https://www.amazon.in/LOOKMUSTER-Waterproof-Backpack-College-Business/dp/B0BZW8KW18/ref=sr_1_52?crid=2M096C61O4MLT&keywords=bags&qid=1688660126&sprefix=ba%2Caps%2C283&sr=8-52,LOOKMUSTER (15.6 inch 30 L Casual Waterproof Laptop Backpack/Office Bag/School Bag/College Bag/Business Bag/Unisex Travel Backpack,₹439,4.1,22,B0BZW8KW18," Care Instructions: Machine Wash COMFORT WITH QUALITY: This casual bag has Wide, Padded and Adjustable shoulder straps and Padded Back for comfort in carrying heavy items. Stitched properly and Bartacks on every pressure point for extra durability. Made with strong yet light weight polyester fabric with heavy zippers. Serves the need of a professional office laptop bag, college bag, student backpack, school bag and is suitable for all, i.e. boys, girls, men? and women? Compact and lightweight travel backpack laptop backpack with 3 compartments. Light weight and spacious",Brand: LOOKMUSTER
https://www.amazon.in/Veneer-Backpack-Fashion-Leather-College/dp/B09BMG8R6Y/ref=sr_1_53?crid=2M096C61O4MLT&keywords=bags&qid=1688660126&sprefix=ba%2Caps%2C283&sr=8-53,"Veneer Medium 20 L Laptop Backpack Men Womens Girls Fashion PU Leather Mini Casual Backpack Bags for School, College, Tuition, Office Bag",₹998,4.2,909,B09BMG8R6Y," Care Instructions: Hand Wash Only Durable and Fashion Style: This bag is soft, comfortable, safe, fashionable and durable, odorless and high-end. This modern fashion stylish backpack bag for girls, womens. It gives amazing look with your outfit. This bag is simple yet quite attractive. This beautiful colour is eye-catchingly and can help you flaunt your distinguished nature.<br><br><br> <br> Target gender: unisex<br><br><br> <br> Material Type: Synthetic; Color Name: Brown; Strap Type: Adjustable; Age Range Description: Adult<br><br> <br> Water Resistance Level: Waterproof; Pattern Name: Solid <br>",Brand: Veneer
https://www.amazon.in/Half-Moon-Resistant-Backpack-Compartment/dp/B0BLVQ9NTD/ref=sr_1_54?crid=2M096C61O4MLT&keywords=bags&qid=1688660126&sprefix=ba%2Caps%2C283&sr=8-54,Half Moon Strike 35L Unisex Spacious School/Laptop/College/Office Travel Backpack Bag for Men Women Boys & Girls with 15.6 inch Padded Laptop Compartment & Multiple Pockets,₹699,3.8,538,B0BLVQ9NTD," MULTI-FUNCTION COMPARTMENT: HALF MOON laptop bag for men features multiple storage compartments and features for additional supplies and accessories as your, iPhone, iPad, pen, keys, wallet, books, clothes, bottle, passport and more. DURABLE MATERIAL: The Laptop bag for men / backpack for men has superior quality durable eco-friendly waterproof and anti-scratch polyester and this office bag for men / Laptop backpacks for men features a reinforced bottom to withstand heavy use, perfect for business, travel, school and other outdoor activities. COMFORTABLE DESIGN IN LAPTOP BAG FOR MEN: Our backpack for men’s ""S"" Curve adjustable, heavily padded shoulder straps and back panel make the college bags for men comfortable to wear even when loaded with all your gear; Compact: The backpack for men / college bags for men has a roomy three compartment, front zipper pockets to hold small accessories, one internal security zippered pocket for valuable items and side pockets for water bottle or umbrella. SIZE OF LAPTOP BAG FOR MEN:18*13*10 inch(L*W*H), Capacity: The office bag for men has capacity of 35L which is bigger than others of the same style. Good size for school, camping, travel, shopping, hiking, climbing, vintage backpack for men and office bag for women. OTHER FEATURES OF OFFICE BAG FOR MEN: The office bag for men and office bag for women has laptop compartment, Internal Organiser (Small Pockets), Strong and durable zippers, Adjustable Shoulder Handles (Straps) , 2 Bottle/Umbrella holders , Padded Handle , Padded Laptop Compartment , Ergonomic Design, Reflector Logo, etc.",Brand: Half Moon 
https://www.amazon.in/Nivia-6853-Polyester-Basic-Duffle/dp/B07FWQ9HRV/ref=sr_1_55?crid=2M096C61O4MLT&keywords=bags&qid=1688660126&sprefix=ba%2Caps%2C283&sr=8-55,NIVIA Basic Duffle Polyester Bag/Gym Bags/Adjustable Shoulder Bag for Men/Duffle Gym Bags for Men/Fitness Bag/Carry Bags/Sports & Travel Bag/Sports Kit/Duffle Bags Travel,₹219,4.0,"3,628",B07FWQ9HRV," Strong stitching at major stress points provide long-lasting durability against daily activities Adjustable shoulder strap Main large compartment with double zip closure High quality double zippers, easy to access Highly water-resistant finish to save inner items from water splashes",Brand: Nivia 
https://www.amazon.in/F-Gear-Luxur-Brown-Backpack/dp/B01F7AX9ZA/ref=sr_1_56?crid=2M096C61O4MLT&keywords=bags&qid=1688660126&sprefix=ba%2Caps%2C283&sr=8-56,F Gear Luxur Brown 25 liter Laptop Backpack (2404),"₹1,099",4.4,"16,898",B01F7AX9ZA," Capacity: 25 liters, Weight: 800 grams, Dimensions: 31 x 18 x 44 cm (L x W x H)",Brand: F Gear 
https://www.amazon.in/Classic-Leather-Laptop-Backpack-LBPCLSLTH1901/dp/B07G4CYC74/ref=sr_1_57?crid=2M096C61O4MLT&keywords=bags&qid=1688660126&sprefix=ba%2Caps%2C283&sr=8-57,Gear Classic 20L Faux Leather Water Resistant Anti Theft Laptop Bag/Backpack for Men/Women-Tan,₹981,4.4,"2,465",B07G4CYC74," Care Instructions: Hand Wash Only Outer material: synthetic, color: tan; Waterproof Capacity: 20 liters; Weight: 560 grams; Dimensions: 48 cms x 32 cms x 14 cms (LxWxH) Number of compartments: 2 Laptop compatibility: yes, laptop size: 16strap type: adjustable Age Range Description: Adult; Special Features: Back Padding; Pocket Description: Utility Pocket; Closure Type: Zipper Concealed quick access Pockets on back panel ,Adjustable Anti sweat padded Shoulder straps , Padded Laptop sleeve,2 External Pockets, Padded Back Panel Cushioned with Anti Sweat Fabric,Embedded Organizer , USB and Headphone cable slot .",Brand: Gear 
https://www.amazon.in/HEROZ-Hammer-Durable-Travel-Laptop/dp/B07MGDFT9C/ref=sr_1_58?crid=2M096C61O4MLT&keywords=bags&qid=1688660126&sprefix=ba%2Caps%2C283&sr=8-58,HEROZ Hammer Unisex Nylon 45 L Travel Laptop Backpack Water Resistant Slim Durable Fits Up to 17.3 Inch Laptop Notebook (All) (Grey & Black),"₹1,499",4.3,"7,987",B07MGDFT9C," Warranty type: Manufacturer, 1 year domestic warranty<br> <br> Special Features: Laptop Compartment; Pocket Description: Utility Pocket; Age Range Description: Adult; Closure Type: Zipper Snap; Pattern Name: Solid; Warranty Description: 1. Year Manufacturer Warranty; Strap Type: Chain; Compartment Description: Greater Than 17 Inches <br>",Brand: HEROZ 
https://www.amazon.in/sspa/click?ie=UTF8&spc=MTo1OTA5OTk1MjA2MTA4NjcwOjE2ODg2NjAxMjY6c3BfbXRmOjIwMTYxMTMxNzgyMDk4OjowOjo&url=%2FHalf-Moon-Backpack-Spacious-Multiple%2Fdp%2FB0C241FLW2%2Fref%3Dsr_1_59_sspa%3Fcrid%3D2M096C61O4MLT%26keywords%3Dbags%26qid%3D1688660126%26sprefix%3Dba%252Caps%252C283%26sr%3D8-59-spons%26sp_csd%3Dd2lkZ2V0TmFtZT1zcF9tdGY%26psc%3D1,Half Moon Aztec 37L School Bag Class 5-12 | College Bagpack for Men/College Back pack for Women | 15.6 inch Laptop Bag for Men/Backpack for Men | Spacious & Multiple Pockets,₹649,3.7,86,B0C241FLW2," This lightweight and spacious laptop bag with 3 compartments contains a dedicated 360 degree protected laptop compartment (up to 17""), so you can you can transport your tech with peace of mind. A Spacious second compartment for essentials like books and files, and a third compartment for extra items. Also features padded shoulder straps and side pockets for water bottles. Carry your books and belongings with ease with this comfortable and durable bagpack! Featuring wide, padded, and adjustable shoulder straps and a padded back, this backpack can handle even heavy loads. Made with strong yet lightweight polyester fabric and heavy-duty zippers, it's built to last. Plus, it comes with a rain cover, perfect for those rainy school or college days. Make a statement on your next trip with our smart and stylish backpack! With a trendy and athletic design, this multipurpose backpack is the perfect combination of style and adventure. Your trips, travel experience cannot get completed without this amazing trekking backpack. Experience enduring and long-lasting performance with our backpack! Made with highly durable material, this backpack is suitable for all weather conditions, including heavy rains and extreme heat. It not only keeps your belongings safe but also resists damage to itself. So, don't settle for anything less. FEATURES: 15.6 inch Laptop compartment, Internal Organiser, Strong and durable zippers, Adjustable Shoulder Handles (Straps) , 2 Bottle/Umbrella holders , Padded Handle , Padded Laptop Compartment , Ergonomic Design, etc",Brand: Half Moon 
https://www.amazon.in/sspa/click?ie=UTF8&spc=MTo1OTA5OTk1MjA2MTA4NjcwOjE2ODg2NjAxMjY6c3BfbXRmOjIwMDkwODYxOTg2Mjk4OjowOjo&url=%2FSwiss-Military-Laptop-Backpack-Canvas%2Fdp%2FB09T9NS7SB%2Fref%3Dsr_1_60_sspa%3Fcrid%3D2M096C61O4MLT%26keywords%3Dbags%26qid%3D1688660126%26sprefix%3Dba%252Caps%252C283%26sr%3D8-60-spons%26sp_csd%3Dd2lkZ2V0TmFtZT1zcF9tdGY%26psc%3D1,Swiss Military Multi Utility Backpack with USB Charging Port - LBP89 and Combo Offers,"₹2,834",3.6,50,B09T9NS7SB," Care Instructions: Wipe with Dry Cloth PRODUCT 1:- Material: 100% Polyester Melange with PU, Capacity: 29.L Approx. Size: 47x32x19(cm) Approx.<br> PRODUCT 1:- Cushion Handle, Utility Pocket For Mobile & Power Bank, Quick Access Pocket<br> PRODUCT 1:- 2 Side Pocket Cum Bottle Holder, Separate Compartment For Files & Organiser Pocket<br> PRODUCT 2:- Solid 16 oz canvas with PU reinforced trims Ideal for travel / leisure with compact storage; PRODUCT 2:- 2.2L Approx. storage capacity<br> Style Name: Casual; Special Features: Laptop Compartment; Closure Type: Zipper; Strap Type: Shoulder Strap; Color Name: Combo Option 3; Water Resistance Level: Water Resistant; Age Range Description: Adult<br>",Brand: Swiss Military
https://www.amazon.in/Safari-Laptop-Backpack-Compartments-Resistant/dp/B09B27S9SG/ref=sr_1_61?crid=2M096C61O4MLT&keywords=bags&qid=1688660126&sprefix=ba%2Caps%2C283&sr=8-61,"Safari Tribe 35 Ltrs Large Laptop Backpack with 3 Compartments, Water Resistant Fabric - Black (TRIBE19CBBLK)","₹1,099",3.8,"1,577",B09B27S9SG," Large multi-compartment backpack with a padded sleeve for laptops, can hold up to 17 inch laptop/notebook Front storage pocket keeps smaller items neatly organized and easy to access Mesh pockets on both sides to accommodate your water bottle and umbrella Mesh Padding on back & shoulder strap to provide comfort & better back support; 1-year International Warranty against manufacturing defects Lining Description: Polyester; Age Range Description: Adult; Special Features: Lightweight; Closure Type: Zipper",Brand: Safari 
https://www.amazon.in/Gear-Training-Travel-Black-Grey-DUFCRSTNG0104/dp/B098FFTDKT/ref=sr_1_62?crid=2M096C61O4MLT&keywords=bags&qid=1688660126&sprefix=ba%2Caps%2C283&sr=8-62,Gear Polyester 23 Cms Travel Duffle Bag (Black),₹479,4.3,"2,156",B098FFTDKT, Ergonomically Designed : Spacious with Multiple Pockets : Intuitive Access : Lightweight : Easily Adjustable Shoulder Strap : Cushioned Grab Handle : Padded Base 3 External Zippered Pockets : 1 Mesh Stash Pocket Outer material type: Polyester Item Package Weight : 340.0 grams,Brand: Gear 
https://www.amazon.in/DZert-School-Polyester-Backpack-White/dp/B07GXYHFCY/ref=sr_1_63?crid=2M096C61O4MLT&keywords=bags&qid=1688660126&sprefix=ba%2Caps%2C283&sr=8-63,DZert Clasy Laptop Bag College Bag for Boys Girls 21 L Blue White,₹339,3.8,"2,461",B07GXYHFCY," Capicity: 21 Litres, Weight: 0.4kg; Dimensions: 45cmX29cmX16cm; Outer Material: Polyester; Inner Material: Polyester<br> Water Repellent: Yes; Laptop Compartment: Yes ; Compartments: 2,one front pocket to hold essentials and A mesh stash pocket on one side to accommodate a drinking bottle & other accessories.<br> Utility: Office, College, School, Camping, Weekend trip, Day trip<br> Accessories shown in the picture are not part of the bag.<br> Closure Type: Zipper; Strap Type: Adjustable; Age Range Description: Kid; Warranty Description: No Warranty; Style Name: Daypack Backpacks; Color Name: Blu-Wht; Water Resistance Level: Water Resistant<br>",Brand: DZert 
https://www.amazon.in/Gear-Black-Casual-Backpack-MDBKPECO50104/dp/B0757MBSS6/ref=sr_1_64?crid=2M096C61O4MLT&keywords=bags&qid=1688660126&sprefix=ba%2Caps%2C283&sr=8-64,Gear Casual Backpack,₹399,3.8,"2,196",B0757MBSS6," Care Instructions: Wipe with Damp Cloth Outer Material: Polyester, Color: Black Grey Water Resistance: Water resistant Capacity: 21 liters; Dimensions: 48 cms x 32 cms x 14 cms (LxWxH) Number of compartments: 1; Laptop Compatibility: No, Strap Type: Adjustable Style Name: Traditional Backpacks; Special Features: Laptop Compartment; Age Range Description: Adult; Closure Type: Zipper; Pocket Description: Utility Pocket",Brand: Gear
https://www.amazon.in/Bagneeds-Synthetic-Leather-Briefcase-Messenger/dp/B0855F8174/ref=sr_1_65?crid=2M096C61O4MLT&keywords=bags&qid=1688660126&sprefix=ba%2Caps%2C283&sr=8-65,Bagneeds Men's Black Synthetic Leather Briefcase Best Laptop Messenger Bag Satchel for Men,₹749,4.1,"4,425",B0855F8174," Suitable for a short business trip or a quick weekend getaway. Size In inches?17""L*4.5""W*12.4""H. weight: 800grm Laptop padding? The laptop padding fits 15.6 inch laptop for business travel. Other compartment fits 17inch Laptop. Large capacity and front and interior pockets organization for all your business needs. Removable, adjustable padded shoulder strap HIGH QUALITY MATERIAL: Made from Premium and Rich quality PU Leather Fabric with Durable Polyester lining. PERFECT GIFT :With a mutlipurpose use and a classy distressed Vintage inspired look which never goes out of style , This bag is a great gift idea for Fathers Day , Birthdays , Valentines Day , Christmas, Graduation, Back To College Or Any Occasion Which Calls For A Gift . Makes a great gift for professionals, artists , students and all sorts of officials. The bag can be used as a Leather messenger bag for men and women ,laptop bags briefcase , college bag, meeting bag, gift idea",Brand: Bagneeds 
https://www.amazon.in/FATMUG-Laptop-Bag-Men-Convertible/dp/B084LF4RT5/ref=sr_1_66?crid=2M096C61O4MLT&keywords=bags&qid=1688660126&sprefix=ba%2Caps%2C283&sr=8-66,"FATMUG Laptop Bag For Men - Convertible Backpack For Office And Travel (Dark Grey,Oxford Fabric)","₹1,599",4.4,"2,081",B084LF4RT5," PRACTICAL AND ELEGANT:Made with Oxford Fabric, a stylish laptop bag for daily travel and short trips<br>; Pocket Description: Utility Pocket; Age Range Description: Adult; Style Name: Travel Backpacks; Special Features: Laptop Compartment<br><br> Pocket Description: Utility Pocket; Special Features: Laptop Compartment; Age Range Description: Adult; Style Name: Travel Backpacks<br> Water Resistance Level: Water Resistant; Compartment Description: Greater Than 17 Inches<br>",Brand: FATMUG 
https://www.amazon.in/Storite-Travel-Bag-Women-Weekender/dp/B0B3JH6K9B/ref=sr_1_67?crid=2M096C61O4MLT&keywords=bags&qid=1688660126&sprefix=ba%2Caps%2C283&sr=8-67,"Storite Nylon 47 Cm Travel Duffle Bag, Sports Shoulder Bag for Women with Wet Pocket Weekender Overnight Luggage Bag - (Pink, 47 x 16 x 30 Cm)","₹1,299",4.3,412,B0B3JH6K9B," Closure Type : Zip , Handle Type : Detachable No of Compartments : 1 Main compartment + 1 small wet pocket + 1 Back Side Mobile pockets + 2 inside Card pocket Strap Type : Two short handles + 1 Shoulder strap handle Item dimensions : Height : 30 cm, Width : 16 cm, Length : 47 cm , 22.6 Litrs , Water Resistant Level : Waterproof Special Feature : This multipurpose Travel Duffle bag is made of premium Oxford Nylon that is durable and water-resistant. The high density water resistant material can help you to separate dry items and wet items (please note : This bag are small in size please check dimension before placing order)",Brand: Storite 
https://www.amazon.in/ADISA-BP004-Weight-Casual-Backpack/dp/B07G3CG9FC/ref=sr_1_68?crid=2M096C61O4MLT&keywords=bags&qid=1688660126&sprefix=ba%2Caps%2C283&sr=8-68,ADISA Laptop Backpack 31 Ltrs,₹399,4.0,"9,387",B07G3CG9FC," Adjustable Shoulder Handles / Two Bottle holders / Padded Top Handle / Reflector Logo NOT INCLUDED: NO RAINCOVER, Headphone & Cable (Images only for display) Laptop Size : 15.6 inches and below (Bigger than 15.6 inches not recommended) Compartments: 2 with full padding; Front Easy-Access Pocket Dimensions : L x W x H- 12 x 7 x 18 inches",Brand: ADISA 
https://www.amazon.in/sspa/click?ie=UTF8&spc=MTo1OTA5OTk1MjA2MTA4NjcwOjE2ODg2NjAxMjY6c3BfYnRmOjIwMTYyMTAxNDMyMzk4OjowOjo&url=%2FEUME-Virgo-29Ltr-Laptop-Backpack%2Fdp%2FB08R58K6QX%2Fref%3Dsr_1_69_sspa%3Fcrid%3D2M096C61O4MLT%26keywords%3Dbags%26qid%3D1688660126%26sprefix%3Dba%252Caps%252C283%26sr%3D8-69-spons%26sp_csd%3Dd2lkZ2V0TmFtZT1zcF9idGY%26psc%3D1,"EUME Virgo 29 Liter, 2 Compartment Office and College Bags, Polyester Casual Daypacks, Laptop Backpacks, Navy Blue Color",₹999,4.1,176,B08R58K6QX," The Eume 29L Virgo Bag has enough space with 3 large compartments, 2 easy-access pockets in Front, and 2 side pockets for a water bottle. The backpack comes with a dedicated tech-safe compartment that can store laptops up to 15.6 inches and enough space to carry for a day's trip. It's water-resistant, good quality zipper, Light Weight and it has padded adjustable shoulder straps for maximum comfort to make your travel journey happier. Dimensions of Backpack: 12 x 8 x 17.75 inches; Bag Weight: 685 grams; Capacity: 29 liters; Fabric: Polyester The Eume Virgo Backpack comes with a 1-year warranty against manufacturing defects.",Brand: EUME 
