Product URL,Product Name,Product Price,Rating,Number of Reviews,ASIN,Description,Manufacturer
https://www.amazon.in/Sfane-Women-Trendy-Black-Duffel/dp/B07GCR84D9/ref=sr_1_151?crid=2M096C61O4MLT&keywords=bags&qid=1688660143&sprefix=ba%2Caps%2C283&sr=8-151,"Sfane Polyester 9.05 Black Men & Women Trendy Black Sports Duffle Gym Bag, Shoulder Bag",₹327,4.2,"1,213",,,
https://www.amazon.in/ADISA-Women-Girls-Floral-SL5072-CRE_Cream/dp/B09B56BCXR/ref=sr_1_152?crid=2M096C61O4MLT&keywords=bags&qid=1688660143&sprefix=ba%2Caps%2C283&sr=8-152,ADISA Women Girls Floral Print Sling Bag,₹469,4.3,"1,160",,,
https://www.amazon.in/Gear-Workspace-Briefcase-Black-Red-BKPWRPHYD0101/dp/B097KGL2M5/ref=sr_1_153?crid=2M096C61O4MLT&keywords=bags&qid=1688660143&sprefix=ba%2Caps%2C283&sr=8-153,Gear Workspace 18L Water Resistant Laptop Bag/Backpack/Office Bag for Men/Women-Black,₹875,4.2,330,,,
https://www.amazon.in/Gear-Black-Casual-Backpack-BKPCMPUS10110/dp/B00Z9427SK/ref=sr_1_154?crid=2M096C61O4MLT&keywords=bags&qid=1688660143&sprefix=ba%2Caps%2C283&sr=8-154,Gear Campus1 22L Water Resistant School Bag/ College Bag/ Backpack For Men/Women-Black Royalblue,₹650,4.3,"3,939",,,
https://www.amazon.in/sspa/click?ie=UTF8&spc=MToxMjExMzQyODIzNTUyMDExOjE2ODg2NjAxNDM6c3BfbXRmOjIwMDYwMjE4OTA0ODk4OjowOjo&url=%2FClownfish-Fusion-Backpack-Laptops-Mustard%2Fdp%2FB07NDVJW44%2Fref%3Dsr_1_155_sspa%3Fcrid%3D2M096C61O4MLT%26keywords%3Dbags%26qid%3D1688660143%26sprefix%3Dba%252Caps%252C283%26sr%3D8-155-spons%26sp_csd%3Dd2lkZ2V0TmFtZT1zcF9tdGY%26psc%3D1,The Clownfish Fusion Series 27 litres Laptop Backpack for 15.6 Inch Laptops (Mustard),"₹1,199",4.1,836,,,
https://www.amazon.in/sspa/click?ie=UTF8&spc=MToxMjExMzQyODIzNTUyMDExOjE2ODg2NjAxNDM6c3BfbXRmOjIwMDk3MjM0OTk2MDk4OjowOjo&url=%2FAmazonBasics-Casual-Backpack-Office-15-6-inch%2Fdp%2FB09W4VMZ79%2Fref%3Dsr_1_156_sspa%3Fcrid%3D2M096C61O4MLT%26keywords%3Dbags%26qid%3D1688660143%26sprefix%3Dba%252Caps%252C283%26sr%3D8-156-spons%26sp_csd%3Dd2lkZ2V0TmFtZT1zcF9tdGY%26psc%3D1,AmazonBasics - Casual Backpack/Office Bag/ for a 15.6-inch Laptop,₹699,4.2,603,,,
https://www.amazon.in/FUR-JADEN-Waterproof-Charging-BM25_Grey/dp/B07FM9BSKW/ref=sr_1_157?crid=2M096C61O4MLT&keywords=bags&qid=1688660143&sprefix=ba%2Caps%2C283&sr=8-157,FUR JADEN 15.6 Anti Theft Laptop Backpack with USB Charging Port Unisex Bag for College Office Suitable for Men Women,₹749,4.0,"6,104",,,
https://www.amazon.in/Derben-Fabric-Leather-Laptop-Messenger/dp/B08TVL3MWJ/ref=sr_1_158?crid=2M096C61O4MLT&keywords=bags&qid=1688660143&sprefix=ba%2Caps%2C283&sr=8-158,"DERBEN CLOVE® 15.6 Men and Women Laptop, MacBook Shoulder Messenger Sling Office Bag - Grey",₹899,4.1,157,,,
https://www.amazon.in/Gear-Classic-Casual-Backpack-BKPCAMPS80304/dp/B019FBEJCO/ref=sr_1_159?crid=2M096C61O4MLT&keywords=bags&qid=1688660143&sprefix=ba%2Caps%2C283&sr=8-159,Gear Campus8 25L Water Resistant School Bag/Backpack/College Bag for Men/Women - Green Grey,₹675,4.1,"1,208",,,
https://www.amazon.in/Martucci-Backpack-College-Reflective-Airport/dp/B0B7DVC3TL/ref=sr_1_160?crid=2M096C61O4MLT&keywords=bags&qid=1688660143&sprefix=ba%2Caps%2C283&sr=8-160,Martucci Large 35 L Backpack Spacy Unisex/College/School/Travel Backpack with Rain Cover and Reflective Strip,₹758,4.0,"1,196",,,
https://www.amazon.in/GreenLands-SG-Backpack-QUAD-L-Grey/dp/B08ML7RWG6/ref=sr_1_161?crid=2M096C61O4MLT&keywords=bags&qid=1688660143&sprefix=ba%2Caps%2C283&sr=8-161,"GREENLANDS 42 Litres Quad Backpack/Bag with Rain Cover for Travel, Upto 17” Laptop, School/College and Work Lightweight and Stylish Bag Men and Women- Light Grey","₹1,742",3.8,96,,,
https://www.amazon.in/Fostelo-Style-Diva-Womens-Handbag/dp/B00Z0NMFKU/ref=sr_1_162?crid=2M096C61O4MLT&keywords=bags&qid=1688660143&sprefix=ba%2Caps%2C283&sr=8-162,Fostelo Style Diva Women Handbags | Shoulder Bags |Bags For Women | Ladies Bags |Hobo Bags |Ladies Purse,₹555,3.9,"9,109",,,
https://www.amazon.in/Impulse-ImpExplore-Backpack-Business-Resistant/dp/B0C1CTRPWF/ref=sr_1_163?crid=2M096C61O4MLT&keywords=bags&qid=1688660143&sprefix=ba%2Caps%2C283&sr=8-163,Impulse ImpExplore 45L Laptop Backpack/Office Bag/School Bag/College Bag/Business Bag/Travel Backpack Water Resistant Fits Up to 16 Inch Laptop with Rain Cover & 1 Year Warranty,₹749,4.0,1,,,
https://www.amazon.in/ROMOFY-Gorgeous-attractive-trendy-crossbody/dp/B0BW9BKHJZ/ref=sr_1_164?crid=2M096C61O4MLT&keywords=bags&qid=1688660143&sprefix=ba%2Caps%2C283&sr=8-164,ROMOFY PU Gorgeous attractive trendy ladies crossbody women sling bag,₹199,3.3,37,,,
https://www.amazon.in/sspa/click?ie=UTF8&spc=MToxMjExMzQyODIzNTUyMDExOjE2ODg2NjAxNDM6c3BfYnRmOjIwMDk3NjEyMjMxMjk4OjowOjo&url=%2Fuppercase-Overnighter-Backpack-Repellent-Sustainable%2Fdp%2FB0B8NV9YX3%2Fref%3Dsr_1_165_sspa%3Fcrid%3D2M096C61O4MLT%26keywords%3Dbags%26qid%3D1688660143%26sprefix%3Dba%252Caps%252C283%26sr%3D8-165-spons%26sp_csd%3Dd2lkZ2V0TmFtZT1zcF9idGY%26psc%3D1,uppercase Medium 21 Ltrs Office Overnighter (14.6 inch) Laptop Backpack 2700EBP1 3x More Water Repellent Sustainable Bags with Rain Proof Zippers Maroon,"₹1,550",3.5,28,,,
https://www.amazon.in/sspa/click?ie=UTF8&spc=MToxMjExMzQyODIzNTUyMDExOjE2ODg2NjAxNDM6c3BfYnRmOjIwMDk3NjEyMjMxNjk4OjowOjo&url=%2Fuppercase-Backpack-1800EBP1-resistant-sustainable%2Fdp%2FB0B9T4YDPX%2Fref%3Dsr_1_166_sspa%3Fcrid%3D2M096C61O4MLT%26keywords%3Dbags%26qid%3D1688660143%26sprefix%3Dba%252Caps%252C283%26sr%3D8-166-spons%26sp_csd%3Dd2lkZ2V0TmFtZT1zcF9idGY%26psc%3D1,"uppercase Laptop Backpack Printed Compact 3x more water repellent sustainable bags with rain proof zippers for Men, Women, Boys & Girls(Pink)","₹1,200",4.3,33,,,
https://www.amazon.in/sspa/click?ie=UTF8&spc=MTo5NTgxMjM0NzE2MjA0MDQ6MTY4ODY2MDE0NjpzcF9hdGZfbmV4dDoyMDE2MTk5NzIzMDU5ODo6MDo6&url=%2FSPENZ-BAGS-Backpack-Raincover-Dark-Blue%2Fdp%2FB0C3RJP6ZM%2Fref%3Dsr_1_161_sspa%3Fcrid%3D2M096C61O4MLT%26keywords%3Dbags%26qid%3D1688660146%26sprefix%3Dba%252Caps%252C283%26sr%3D8-161-spons%26sp_csd%3Dd2lkZ2V0TmFtZT1zcF9hdGZfbmV4dA%26psc%3D1,"SPENZ BAGS Travel Laptop Backpack for Women & Men|Carry On Bag, College & School Students Bookbag With Raincover",₹999,4.6,100,,,
https://www.amazon.in/sspa/click?ie=UTF8&spc=MTo5NTgxMjM0NzE2MjA0MDQ6MTY4ODY2MDE0NjpzcF9hdGZfbmV4dDoyMDE2NDY4NzUxNjg5ODo6MDo6&url=%2FWALKENT-Leather-Anti-Theft-Backpack-Dandy%2Fdp%2FB0C6TBHQ82%2Fref%3Dsr_1_162_sspa%3Fcrid%3D2M096C61O4MLT%26keywords%3Dbags%26qid%3D1688660146%26sprefix%3Dba%252Caps%252C283%26sr%3D8-162-spons%26sp_csd%3Dd2lkZ2V0TmFtZT1zcF9hdGZfbmV4dA%26psc%3D1,"WALKENT 15.6"" Vegan Leather Laptop Bag with Side Bottle & Anti-Theft Pockets & More, Backpack for Men & Women (Model Dandy, 21 Liters, Brown)","₹2,990",Not available,Not available,,,
https://www.amazon.in/Bennett-15-6-inch-College-Repellent-Backpack/dp/B09WZKHSDR/ref=sr_1_163?crid=2M096C61O4MLT&keywords=bags&qid=1688660146&sprefix=ba%2Caps%2C283&sr=8-163,"Bennett Casual Laptop Bag School Bags for Boys Girls 15.6-inch, 25 LTR Office & College bags for Mens Water Repellent Backpack for Men & Women (GREY)",₹512,3.9,165,,,
https://www.amazon.in/Skybags-Unisex-Grey-Jacqard-Laptop/dp/B09ZV9SLBJ/ref=sr_1_164?crid=2M096C61O4MLT&keywords=bags&qid=1688660146&sprefix=ba%2Caps%2C283&sr=8-164,Skybags Unisex Grey Jacqard 34L Laptop Bags,"₹1,009",3.8,54,,,
https://www.amazon.in/Number-Backpack-Compartment-Charging-Organizer/dp/B09VTC876Z/ref=sr_1_165?crid=2M096C61O4MLT&keywords=bags&qid=1688660146&sprefix=ba%2Caps%2C283&sr=8-165,"FUR JADEN Anti Theft Number Lock Backpack Bag with 15.6 Inch Laptop Compartment, USB Charging Port & Organizer Pocket for Men Women Boys Girls",₹670,4.0,"4,640",,,
https://www.amazon.in/Gear-Bounce-Backpack-Grey-Orange-BKPBOUNCE0604/dp/B097KCLF5F/ref=sr_1_166?crid=2M096C61O4MLT&keywords=bags&qid=1688660146&sprefix=ba%2Caps%2C283&sr=8-166,Gear Bounce 27 Ltrs Water Resistant School Bag/Backpack/College Bag for Men/Women-Grey Orange,₹615,3.7,458,,,
https://www.amazon.in/Lenovo-Carrying-15-6-Inch-Toploader-GX40Q17229/dp/B075Y6Y9H5/ref=sr_1_167?crid=2M096C61O4MLT&keywords=bags&qid=1688660146&sprefix=ba%2Caps%2C283&sr=8-167,Lenovo 15.6-inch Casual Laptop Briefcase T210,₹799,4.2,"20,131",,,
https://www.amazon.in/Gear-Clubsport-Faux-Leather-Black-Red-DUFCLBSRT0109/dp/B097KCLVCP/ref=sr_1_168?crid=2M096C61O4MLT&keywords=bags&qid=1688660146&sprefix=ba%2Caps%2C283&sr=8-168,Gear Clubsport 26 Ltrs Faux-Leather Water Resistant Travel Duffle Bag/Gym Bag for Men/Women - Black Red,₹703,4.2,311,,,
https://www.amazon.in/POLESTAR-Navyorg-Casual-bagpack-Backpack/dp/B0844R2GMK/ref=sr_1_169?crid=2M096C61O4MLT&keywords=bags&qid=1688660146&sprefix=ba%2Caps%2C283&sr=8-169,"POLESTAR Space 34 L Bag for College, School, Office, Casual Multipurpose Backpack with 15.6"" Laptop Compartment, Water Resistant, Unisex Design, Stylish & Durable, 1 Year Warranty",₹549,4.0,"6,336",,,
https://www.amazon.in/LL-LEATHER-LAND-DESIGNER-BAGS/dp/B0BD4TTDHD/ref=sr_1_170?crid=2M096C61O4MLT&keywords=bags&qid=1688660146&sprefix=ba%2Caps%2C283&sr=8-170,LL LEATHER LAND DESIGNER BAGS Women Sling Bag,₹299,4.0,"1,848",,,
https://www.amazon.in/sspa/click?ie=UTF8&spc=MTo5NTgxMjM0NzE2MjA0MDQ6MTY4ODY2MDE0NjpzcF9tdGY6MjAxMDIyMjc5MjkzOTg6OjA6Og&url=%2Fuppercase-Backpack-2500EBP2-repellent-sustainable%2Fdp%2FB0BNVXG27V%2Fref%3Dsr_1_171_sspa%3Fcrid%3D2M096C61O4MLT%26keywords%3Dbags%26qid%3D1688660146%26sprefix%3Dba%252Caps%252C283%26sr%3D8-171-spons%26sp_csd%3Dd2lkZ2V0TmFtZT1zcF9tdGY%26psc%3D1,"uppercase Medium 21L Quilted Laptop Backpack 2500EBP2 3x more water repellent sustainable bags with rain proof zippers for Men, Women, Boys and Girls, 750 Days warranty","₹1,400",4.7,16,,,
https://www.amazon.in/sspa/click?ie=UTF8&spc=MTo5NTgxMjM0NzE2MjA0MDQ6MTY4ODY2MDE0NjpzcF9tdGY6MzAwMDA4MTYxODYxOTMyOjowOjo&url=%2FHi-Speed%25C2%25AE-Restant-Office-Laptop-Backpack%2Fdp%2FB0C7C3QDYJ%2Fref%3Dsr_1_172_sspa%3Fcrid%3D2M096C61O4MLT%26keywords%3Dbags%26qid%3D1688660146%26sprefix%3Dba%252Caps%252C283%26sr%3D8-172-spons%26sp_csd%3Dd2lkZ2V0TmFtZT1zcF9tdGY%26psc%3D1,Hi-Speed® 30L Water Restant Office Laptop Bag/Backpack for Men/Women,₹989,Not available,Not available,,,
https://www.amazon.in/Tabelito-NEXA-Backpack-Business-Compartment/dp/B0C2D4KWQ6/ref=sr_1_173?crid=2M096C61O4MLT&keywords=bags&qid=1688660146&sprefix=ba%2Caps%2C283&sr=8-173,"Tabelito® NEXA 3O L Water Resistant Laptop/College/Office/School/Travel/Business Bag, Unisex Backpack for Men Women Fits Up to 15.6 Inch Laptop Notebook. (GREY)",₹399,4.7,59,,,
https://www.amazon.in/SFANE-Duffel-Shoulder-Women-Compartment/dp/B07ZC77WTW/ref=sr_1_174?crid=2M096C61O4MLT&keywords=bags&qid=1688660146&sprefix=ba%2Caps%2C283&sr=8-174,"SFANE Polyester 23 cms Navy Blue Gym Bag, Shoulder Bag, Sports Bag for Men & Women with Separate Shoes Compartment (Blue)",₹437,4.4,"2,842",,,
https://www.amazon.in/Genie-Clara-Backpack-Women-compartments/dp/B097JJGR1N/ref=sr_1_175?crid=2M096C61O4MLT&keywords=bags&qid=1688660146&sprefix=ba%2Caps%2C283&sr=8-175,"Genie Clara Backpack for Women - 3 compartments, Laptop Bags for Girls, Stylish and Trendy College Backpacks for Girls, Water Resistant and Lightweight Bags for Office and Travelling Purpose.","₹1,279",4.4,183,,,
https://www.amazon.in/F-Gear-Burner-Casual-Laptop-Backpack/dp/B016115VXW/ref=sr_1_176?crid=2M096C61O4MLT&keywords=bags&qid=1688660146&sprefix=ba%2Caps%2C283&sr=8-176,F Gear Burner P8 19 Ltrs White Casual Laptop Backpack,₹637.97,4.3,"3,983",,,
https://www.amazon.in/DZert-School-Plush-Backpacks-Cartoon/dp/B08BCP78YF/ref=sr_1_177?crid=2M096C61O4MLT&keywords=bags&qid=1688660146&sprefix=ba%2Caps%2C283&sr=8-177,DZert Kids School Bag Soft Plush Backpacks Cartoon Boys Girls Baby (2-5 Years),₹249,3.7,971,,,
https://www.amazon.in/Fur-Jaden-resistant-Backpack-BM100_Brown/dp/B07P5X6NSN/ref=sr_1_178?crid=2M096C61O4MLT&keywords=bags&qid=1688660146&sprefix=ba%2Caps%2C283&sr=8-178,FUR JADEN Vegan Leather 30L 15.6 Inch Laptop Backpack for Men Women for Office Professionals and College Students Brown,₹839,4.2,"2,311",,,
https://www.amazon.in/Tommy-Hilfiger-Nashville-Overnighter-Travel/dp/B0C3ZQBRT3/ref=sr_1_179?crid=2M096C61O4MLT&keywords=bags&qid=1688660146&sprefix=ba%2Caps%2C283&sr=8-179,"Tommy Hilfiger Nashville Black Overnighter for Travel - 51Ltrs, 15 Inch Laptop Capacity 4 Wheel Trolley Bag","₹3,499",5.0,1,,,
https://www.amazon.in/Safari-Overnighter-Resistant-Travelling-All-Purpose/dp/B097JM98M1/ref=sr_1_180?crid=2M096C61O4MLT&keywords=bags&qid=1688660146&sprefix=ba%2Caps%2C283&sr=8-180,"Safari Seek 32 Ltrs Overnighter Travel Laptop Backpack (Blue), Water Resistant Spacious Bag for Travelling and Camping, All-Purpose Bag for Business & Leisure","₹1,899",4.3,148,,,
https://www.amazon.in/sspa/click?ie=UTF8&spc=MTo5NTgxMjM0NzE2MjA0MDQ6MTY4ODY2MDE0NjpzcF9idGY6MjAxNjExMzE3ODIxOTg6OjA6Og&url=%2FHalf-Moon-Backpack-Spacious-Multiple%2Fdp%2FB0C23Y7N1Q%2Fref%3Dsr_1_181_sspa%3Fcrid%3D2M096C61O4MLT%26keywords%3Dbags%26qid%3D1688660146%26sprefix%3Dba%252Caps%252C283%26sr%3D8-181-spons%26sp_csd%3Dd2lkZ2V0TmFtZT1zcF9idGY%26psc%3D1,Half Moon Aztec 37L School Bag Class 5-12 | College Bagpack for Men/College Back pack for Women | 15.6 inch Laptop Bag for Men/Backpack for Men | Spacious & Multiple Pockets,₹649,3.7,86,,,
https://www.amazon.in/sspa/click?ie=UTF8&spc=MTo5NTgxMjM0NzE2MjA0MDQ6MTY4ODY2MDE0NjpzcF9idGY6MjAxMTIxOTEzNDA2OTg6OjA6Og&url=%2FArtistix-Alpine-Laptop-Backpack-Business%2Fdp%2FB08SVV5HZY%2Fref%3Dsr_1_182_sspa%3Fcrid%3D2M096C61O4MLT%26keywords%3Dbags%26qid%3D1688660146%26sprefix%3Dba%252Caps%252C283%26sr%3D8-182-spons%26sp_csd%3Dd2lkZ2V0TmFtZT1zcF9idGY%26psc%3D1,"Artistix Alpine Business Class Series | Anti Theft Laptop Backpack (32 Litre, 15.6 inch) (Black)","₹1,783",4.4,"1,142",,,
https://www.amazon.in/sspa/click?ie=UTF8&spc=MToyOTMxNjU2MTg0MzM5Mzc5OjE2ODg2NjAxNDk6c3BfYXRmX25leHQ6MjAxMjAyODcwNzY2OTg6OjA6Og&url=%2FTaken-Print-Laptop-Backpack-School%2Fdp%2FB08YP77894%2Fref%3Dsr_1_177_sspa%3Fcrid%3D2M096C61O4MLT%26keywords%3Dbags%26qid%3D1688660149%26sprefix%3Dba%252Caps%252C283%26sr%3D8-177-spons%26sp_csd%3Dd2lkZ2V0TmFtZT1zcF9hdGZfbmV4dA%26psc%3D1,"MY FAV Printed Laptop Bag Backpack/Casual School College Bag/Sports Backpack for Boys/Girls, Outdoor Travel Lightweight Bag (30 L)","₹1,100",3.8,113,,,
https://www.amazon.in/sspa/click?ie=UTF8&spc=MToyOTMxNjU2MTg0MzM5Mzc5OjE2ODg2NjAxNDk6c3BfYXRmX25leHQ6MjAwMzQzODg5NjczOTg6OjA6Og&url=%2FHalf-Moon-Waterproof-Backpack-Students%2Fdp%2FB085MHDJ93%2Fref%3Dsr_1_178_sspa%3Fcrid%3D2M096C61O4MLT%26keywords%3Dbags%26qid%3D1688660149%26sprefix%3Dba%252Caps%252C283%26sr%3D8-178-spons%26sp_csd%3Dd2lkZ2V0TmFtZT1zcF9hdGZfbmV4dA%26psc%3D1,"Half Moon 35L Water Resistant 15.6 inch Laptop Bag for Men/Backpack for Men, Navy Blue | Office Bag for Men/Office Bag for Women with Padded Laptop Compartment | Rain Cover & Reflective Strips",₹649,3.9,"16,375",,,
https://www.amazon.in/Safari-Overnighter-Resistant-Travelling-All-Purpose/dp/B097JM98M1/ref=sr_1_179?crid=2M096C61O4MLT&keywords=bags&qid=1688660149&sprefix=ba%2Caps%2C283&sr=8-179,"Safari Seek 32 Ltrs Overnighter Travel Laptop Backpack (Blue), Water Resistant Spacious Bag for Travelling and Camping, All-Purpose Bag for Business & Leisure","₹1,899",4.3,148,,,
https://www.amazon.in/Shopiable-Store-Travelling-Lightweight-Waterproof/dp/B0B5VMZVXZ/ref=sr_1_180?crid=2M096C61O4MLT&keywords=bags&qid=1688660149&sprefix=ba%2Caps%2C283&sr=8-180,Shopiable Store Folding Storage Luggage Bag Travelling Shoulder Hand Bags Lightweight Waterproof Duffle Bag for Women (Pink),₹379,4.0,13,,,
https://www.amazon.in/Gear-Compact-Business-Backpack-BUSCOMPACT052/dp/B08D76WDTV/ref=sr_1_181?crid=2M096C61O4MLT&keywords=bags&qid=1688660149&sprefix=ba%2Caps%2C283&sr=8-181,Gear Compact Business 18L Water Resistant Laptop Bag/Backpack/Office Bag For Men/Women - Indiaink,₹789,4.2,"1,128",,,
https://www.amazon.in/Impulse-Impbee-Backpack-Business-Resistant/dp/B0C1CSS81H/ref=sr_1_182?crid=2M096C61O4MLT&keywords=bags&qid=1688660149&sprefix=ba%2Caps%2C283&sr=8-182,Impulse Impbee 45L Laptop Backpack/Office Bag/School Bag/College Bag/Business Bag/Travel Backpack Water Resistant Fits Up to 16 Inch Laptop with Rain Cover & 1 Year Warranty,₹936,4.5,4,,,
https://www.amazon.in/Half-Moon-Laptop-Backpack-Polyester/dp/B09CMS3K2S/ref=sr_1_183?crid=2M096C61O4MLT&keywords=bags&qid=1688660149&sprefix=ba%2Caps%2C283&sr=8-183,Half Moon 30L Water Resistant 15.6 inch Laptop Bag/Backpack for Men | School Bag for Boys Girls | Office Bag pack for Men/Office Back Packed for Women with Padded Laptop Compartment,₹599,3.7,68,,,
https://www.amazon.in/Wildcraft-Green-Casual-Backpack-11650-Green/dp/B079DV66TY/ref=sr_1_184?crid=2M096C61O4MLT&keywords=bags&qid=1688660149&sprefix=ba%2Caps%2C283&sr=8-184,Wildcraft 29.5 Ltrs Green Casual Backpack (11650-Green),"₹1,029",4.1,383,,,
https://www.amazon.in/TRUE-Anti-Theft-backpack-charging-Epower_B/dp/B0BYBDX8VP/ref=sr_1_185?crid=2M096C61O4MLT&keywords=bags&qid=1688660149&sprefix=ba%2Caps%2C283&sr=8-185,"TRUE HUMAN® Emperor Anti-Theft Pocket backpack With USB charging Port Laptop,office,college,travel bag for men and women(Epower)",₹649,3.6,133,,,
https://www.amazon.in/POLESTAR-backpack-Backpack-College-Students/dp/B08X2KRL8B/ref=sr_1_186?crid=2M096C61O4MLT&keywords=bags&qid=1688660149&sprefix=ba%2Caps%2C283&sr=8-186,"POLESTAR Leader 34 L Bag for College, School, Office, Casual Multipurpose Backpack with 15.6"" Laptop Compartment, Water Resistant, Unisex Design, Stylish & Durable, 1 Year Warranty",₹599,4.1,"3,516",,,
https://www.amazon.in/sspa/click?ie=UTF8&spc=MToyOTMxNjU2MTg0MzM5Mzc5OjE2ODg2NjAxNDk6c3BfbXRmOjMwMDAwOTQ0MjY0MzIzMjo6MDo6&url=%2FHarissons-Stud-Laptop-Navy-Backpack%2Fdp%2FB01267XEQ6%2Fref%3Dsr_1_187_sspa%3Fcrid%3D2M096C61O4MLT%26keywords%3Dbags%26qid%3D1688660149%26sprefix%3Dba%252Caps%252C283%26sr%3D8-187-spons%26sp_csd%3Dd2lkZ2V0TmFtZT1zcF9tdGY%26psc%3D1,Harissons Stud 15.6 Inch Laptop Backpack for Men & Women 34 Ltrs Polyester (Navy Blue) | Spacious and Water Resistant Travel Bag | Ergo Grip Backstraps with Elevated Laptop Compartment,"₹1,478",4.2,64,,,
https://www.amazon.in/sspa/click?ie=UTF8&spc=MToyOTMxNjU2MTg0MzM5Mzc5OjE2ODg2NjAxNDk6c3BfbXRmOjMwMDAwOTI2MDg5MDQzMjo6MDo6&url=%2FOPTIMA-Backpack-Business-Durable-Laptops%2Fdp%2FB08QF9L71K%2Fref%3Dsr_1_188_sspa%3Fcrid%3D2M096C61O4MLT%26keywords%3Dbags%26qid%3D1688660149%26sprefix%3Dba%252Caps%252C283%26sr%3D8-188-spons%26sp_csd%3Dd2lkZ2V0TmFtZT1zcF9tdGY%26psc%3D1,"OPTIMA Travel Laptop Backpack, Business Slim Durable Laptops Backpack Combo","₹1,099",Not available,Not available,,,
https://www.amazon.in/Shoulder-Lightweight-Duffle-Weekend-Blue-Orange/dp/B09139DYF1/ref=sr_1_189?crid=2M096C61O4MLT&keywords=bags&qid=1688660149&sprefix=ba%2Caps%2C283&sr=8-189,"Aurion Vista Polyester Sports Gym Duffle Bag with Wet Pocket and Shoe Compartment - 1Pc (Blue, 24 Cms) | Lightweight Duffle Bags | Travel Duffel Backpack for Men and Women | Camping | Swimming | Yoga",₹349,4.0,"1,073",,,
https://www.amazon.in/Skybags-Cardiff-Polyester-Travel-DFCAR55RED/dp/B073JSGN6G/ref=sr_1_190?crid=2M096C61O4MLT&keywords=bags&qid=1688660149&sprefix=ba%2Caps%2C283&sr=8-190,Skybags Cardiff Polyester 55 Cms Travel Duffle Bag (Red),₹849,4.2,"9,656",,,
https://www.amazon.in/Hammonds-Flycatcher-Leather-Messenger-LB190BRN/dp/B083M1QK32/ref=sr_1_191?crid=2M096C61O4MLT&keywords=bags&qid=1688660149&sprefix=ba%2Caps%2C283&sr=8-191,HAMMONDS FLYCATCHER Laptop Bag for Men - Genuine Leather Messenger Shoulder Bag - Fits 14/15.6/16 Inch Laptops - Brown Office Bag - Multiple Pockets -Water Resistant -Executive Bag for Work and Travel,"₹5,255",4.4,566,,,
https://www.amazon.in/Half-Moon-Resistant-Backpack-Compartment/dp/B09GG53CSL/ref=sr_1_192?crid=2M096C61O4MLT&keywords=bags&qid=1688660149&sprefix=ba%2Caps%2C283&sr=8-192,Half Moon 34 L Water Resistant 15.6 inch Laptop Bag/Backpack for Men Women Boys Girls/Office School College with Padded Laptop Compartment (Grey),₹699,3.9,"1,330",,,
https://www.amazon.in/GoTrippin-Camping-Outdoors-Polyester-Adjustable/dp/B088LHS5LP/ref=sr_1_193?crid=2M096C61O4MLT&keywords=bags&qid=1688660149&sprefix=ba%2Caps%2C283&sr=8-193,"GoTrippin Waist Bags for Men Women- Premium Stitching, Branded Zippers, Waterproof pocket, RFID safe- Large Fanny pack for Hiking Travel Camping Running Sports Outdoors, Money Belt with Adjustable Strap (Polyester,Black)",₹999,4.5,"2,125",,,
https://www.amazon.in/Polyester-Crossbody-Messenger-Business-Spacious/dp/B09TL193PL/ref=sr_1_194?crid=2M096C61O4MLT&keywords=bags&qid=1688660149&sprefix=ba%2Caps%2C283&sr=8-194,CRALOFT Polyester 11.5 inch Side Bag For Men/Sling Bag/Crossbody Tablet Messenger Bag For Office Business Travel (Extra Spacious),₹569,4.3,438,,,
https://www.amazon.in/Lenovo-Carrying-15-6-Inch-Toploader-GX40Q17230/dp/B075Y8294N/ref=sr_1_195?crid=2M096C61O4MLT&keywords=bags&qid=1688660149&sprefix=ba%2Caps%2C283&sr=8-195,Lenovo 15.6-inch Casual Laptop Briefcase T210,₹799,4.3,"4,297",,,
https://www.amazon.in/Gear-Green-Casual-Backpack-BKPECOBP40503/dp/B019HA8DQQ/ref=sr_1_196?crid=2M096C61O4MLT&keywords=bags&qid=1688660149&sprefix=ba%2Caps%2C283&sr=8-196,Gear Eco4 18L Water Resistant School Bag//Backpack/College Bag for Men/Women - Navy Blue,₹499,4.0,"4,246",,,
https://www.amazon.in/sspa/click?ie=UTF8&spc=MToyOTMxNjU2MTg0MzM5Mzc5OjE2ODg2NjAxNDk6c3BfYnRmOjIwMDQzNjc3NzMyNzA4OjowOjo&url=%2FLunars-Travel-Laptop-Bag-compartments%2Fdp%2FB08NHL52MK%2Fref%3Dsr_1_197_sspa%3Fcrid%3D2M096C61O4MLT%26keywords%3Dbags%26qid%3D1688660149%26sprefix%3Dba%252Caps%252C283%26sr%3D8-197-spons%26sp_csd%3Dd2lkZ2V0TmFtZT1zcF9idGY%26psc%3D1,"Lunar's Unisex 50L Water Resistant Office/Travel/Business Laptop Backpack, Bag for up to 17.3 inch Laptop/MacBook with rain Cover and 2 Large compartments","₹1,199",4.0,"2,638",,,
https://www.amazon.in/sspa/click?ie=UTF8&spc=MToyOTMxNjU2MTg0MzM5Mzc5OjE2ODg2NjAxNDk6c3BfYnRmOjIwMDIxNDI2NjM3ODA2OjowOjo&url=%2FKiller-Backpack-Compartments-Polyester-Waterproof%2Fdp%2FB07BVX11W4%2Fref%3Dsr_1_198_sspa%3Fcrid%3D2M096C61O4MLT%26keywords%3Dbags%26qid%3D1688660149%26sprefix%3Dba%252Caps%252C283%26sr%3D8-198-spons%26sp_csd%3Dd2lkZ2V0TmFtZT1zcF9idGY%26psc%3D1,KILLER Derby 38L Large Laptop Backpack With 2 Compartments Polyester Travel Backpack,"₹1,729",4.3,"4,536",,,
https://www.amazon.in/sspa/click?ie=UTF8&spc=MToyOTA5MDg5MzA5MjkzMzEyOjE2ODg2NjAxNTI6c3BfYXRmX25leHQ6MjAwMzMxNzk4NTMzMDI6OjA6Og&url=%2FF-Gear-Tandrum-Olive-Green-Laptop-Backpack%2Fdp%2FB07X6W2Q7F%2Fref%3Dsr_1_193_sspa%3Fcrid%3D2M096C61O4MLT%26keywords%3Dbags%26qid%3D1688660152%26sprefix%3Dba%252Caps%252C283%26sr%3D8-193-spons%26sp_csd%3Dd2lkZ2V0TmFtZT1zcF9hdGZfbmV4dA%26psc%3D1,F Gear Tandrum V2 28 Ltrs Olive Green Laptop Backpack (3189),"₹1,299",4.3,30,,,
https://www.amazon.in/sspa/click?ie=UTF8&spc=MToyOTA5MDg5MzA5MjkzMzEyOjE2ODg2NjAxNTI6c3BfYXRmX25leHQ6MzAwMDAzOTA2NzQ5NzMyOjowOjo&url=%2FEUME-Shield-Laptop-Backpack-Charging%2Fdp%2FB07GYRT442%2Fref%3Dsr_1_194_sspa%3Fcrid%3D2M096C61O4MLT%26keywords%3Dbags%26qid%3D1688660152%26sprefix%3Dba%252Caps%252C283%26sr%3D8-194-spons%26sp_csd%3Dd2lkZ2V0TmFtZT1zcF9hdGZfbmV4dA%26psc%3D1,"EUME Shield 21 Liters Anti-Theft 180-degree Opening Compartment for Laptop Backpacks Polyester Fabric College Office, and Mini Travel Bags Fits Up to 15.6-inch Laptop","₹1,999",4.1,130,,,
https://www.amazon.in/Aspire-Laptop-Backpack-Resistant-Macbook/dp/B0BYSXLVNN/ref=sr_1_195?crid=2M096C61O4MLT&keywords=bags&qid=1688660152&sprefix=ba%2Caps%2C283&sr=8-195,"Fendo Aspire 27L Laptop Bag, Office Bag for Men | Backpack for Men, School Bags for Boys | Water Resistant | Fits up to 15.6 inch Laptop, Macbook | (Grey)",₹582,4.6,16,,,
https://www.amazon.in/Skybags-Cardiff-Polyester-Travel-DFCAR55RED/dp/B073JSGN6G/ref=sr_1_196?crid=2M096C61O4MLT&keywords=bags&qid=1688660152&sprefix=ba%2Caps%2C283&sr=8-196,Skybags Cardiff Polyester 55 Cms Travel Duffle Bag (Red),₹849,4.2,"9,656",,,
https://www.amazon.in/Aristocrat-Zeal-Unisex-Grey-Laptop/dp/B0B5YHC1W5/ref=sr_1_197?crid=2M096C61O4MLT&keywords=bags&qid=1688660152&sprefix=ba%2Caps%2C283&sr=8-197,Aristrocrat Unisex Laptop Bag Grey One Size,₹799,4.2,27,,,
https://www.amazon.in/GoTrippin-Camping-Outdoors-Polyester-Adjustable/dp/B088LHS5LP/ref=sr_1_198?crid=2M096C61O4MLT&keywords=bags&qid=1688660152&sprefix=ba%2Caps%2C283&sr=8-198,"GoTrippin Waist Bags for Men Women- Premium Stitching, Branded Zippers, Waterproof pocket, RFID safe- Large Fanny pack for Hiking Travel Camping Running Sports Outdoors, Money Belt with Adjustable Strap (Polyester,Black)",₹999,4.5,"2,125",,,
https://www.amazon.in/F-Gear-Circadian-Guc-Black-Casual-Backpack/dp/B084THQXCD/ref=sr_1_199?crid=2M096C61O4MLT&keywords=bags&qid=1688660152&sprefix=ba%2Caps%2C283&sr=8-199,F Gear Circadian Guc Black 27 Ltrs Casual Backpack (3330),₹799,4.2,710,,,
https://www.amazon.in/HAMMONDS-FLYCATCHER-Genuine-Shoulder-Messenger/dp/B07P2TQH78/ref=sr_1_200?crid=2M096C61O4MLT&keywords=bags&qid=1688660152&sprefix=ba%2Caps%2C283&sr=8-200,"HAMMONDS FLYCATCHER Genuine Leather Laptop Bag for Men - Office Bag, Brown Color - Fits Up to 14/15.6/16 Inch Laptop/MacBook - Laptop Messenger Bags/Leather Bag for Men with Adjustable Shoulder Strap","₹2,623",4.3,"4,946",,,
https://www.amazon.in/Gear-Green-Casual-Backpack-BKPECOBP40503/dp/B019HA8DQQ/ref=sr_1_201?crid=2M096C61O4MLT&keywords=bags&qid=1688660152&sprefix=ba%2Caps%2C283&sr=8-201,Gear Eco4 18L Water Resistant School Bag//Backpack/College Bag for Men/Women - Navy Blue,₹499,4.0,"4,246",,,
https://www.amazon.in/American-Tourister-Polyester-Compartment-Backpack/dp/B0BWFFFT5H/ref=sr_1_202?crid=2M096C61O4MLT&keywords=bags&qid=1688660152&sprefix=ba%2Caps%2C283&sr=8-202,"American Tourister Sest+ Polyester 2 Compartment Unisex Backpack (Grey,Frsz)","₹1,672",4.0,39,,,
