Product URL,Product Name,Product Price,Rating,Number of Reviews,ASIN,Description,Manufacturer
https://www.amazon.in/sspa/click?ie=UTF8&spc=MTo2MjcyMDg0MzA3OTIxMzQ1OjE2ODg2NjAxMzE6c3BfbXRmOjMwMDAwOTI2MDg4ODczMjo6MDo6&url=%2FOptima-Trending-Expendable-Laptop-Backpack%2Fdp%2FB0827J8273%2Fref%3Dsr_1_92_sspa%3Fcrid%3D2M096C61O4MLT%26keywords%3Dbags%26qid%3D1688660131%26sprefix%3Dba%252Caps%252C283%26sr%3D8-92-spons%26sp_csd%3Dd2lkZ2V0TmFtZT1zcF9tdGY%26psc%3D1,OPTIMA Trending Expendable 25 L Laptop Backpack (Blue),₹598,3.7,6,B0827J8273, Optima Trending Expendable 25 L Laptop Backpack<br><br> Optima laptop backpack have one big compartment to carry items in travel<br><br> optima laptop backpack easy to carry<br>; Optima laptop backpack awesome look and stylish backpack<br><br> Pattern Name: Solid; Pocket Description: Pork Chop Pocket; Lining Description: Polyester; Closure Type: Zipper; Special Features: Laptop Compartment; Theme: Sports; Age Range Description: Adult<br> Pattern Name: Solid; Pocket Description: Pork Chop Pocket; Special Features: Laptop Compartment; Age Range Description: Adult; Lining Description: Polyester; Theme: Sports; Closure Type: Zipper,Brand: OPTIMA 
https://www.amazon.in/Hilfiger-Joshua-Backpack-TH-JOSHUALAP01/dp/B07N8GRWTZ/ref=sr_1_93?crid=2M096C61O4MLT&keywords=bags&qid=1688660131&sprefix=ba%2Caps%2C283&sr=8-93,Tommy Hilfiger Joshua 21 Ltrs Black Laptop Backpack (TH/JOSHUALAP01),"₹1,919",4.1,322,B07N8GRWTZ," Care Instructions: Hand Wash Only Outer Material: Polyester, Color: Black;Water resistant<br> Capacity: 21 liters; Dimensions: 32 cms x 14 cms x 46 cms (LxWxH)<br> Number of compartments: 3; Laptop Compatibility: Yes, Laptop Size: 15 inches<br> Warranty type: Manufacturer; 1 year<br> Closure Type: Zipper; Age Range Description: Adult<br>",Brand: Tommy Hilfiger 
https://www.amazon.in/Gear-Vintage2-Leather-Backpack-LBPVG2LTH0101/dp/B07G44G1DC/ref=sr_1_94?crid=2M096C61O4MLT&keywords=bags&qid=1688660131&sprefix=ba%2Caps%2C283&sr=8-94,Gear Vintage2 28L Faux Leather Water Resistant Anti Theft Laptop Bag/Backpack for Men/Women-Black,₹981,4.4,"1,817",B07G44G1DC," Care Instructions: Hand Wash Only Outer material: synthetic, color: black; Waterproof Capacity: 28 liters; Weight: 600 grams; Dimensions: 48 cms x 33 cms x 18 cms (LxWxH) Number of compartments: 2 Laptop compatibility: yes, laptop size: 16strap type: adjustable Special Features: Back Padding; Age Range Description: Adult; Pocket Description: Utility Pocket; Closure Type: Zipper Concealed quick access Pockets on back panel ,Adjustable Anti sweat padded Shoulder straps , Padded Laptop sleeve,3 External Pockets, Padded Back Panel Cushioned with Anti Sweat Fabric,Embedded Organizer , USB and Headphone cable slot .",Brand: Gear 
https://www.amazon.in/Mi-Business-Casual-Resistant-Backpack/dp/B07YY6PTMN/ref=sr_1_95?crid=2M096C61O4MLT&keywords=bags&qid=1688660131&sprefix=ba%2Caps%2C283&sr=8-95,MI Business Casual 21L Water Resistant Laptop Backpack,₹949,4.4,"4,484",B07YY6PTMN," Care Instructions: Hand Wash Only 21L Capacity: The Backpack has a padded laptop compartment that can fit 15.2 inch laptop. It can also accommodate essentials such as a Lunch box, Charger, Tablet, Books, Power Bank, Wallet, and Sunglass. Dimension(L*W*D): 44*32*16 cm Water Resistant Material: Advanced IPX4 coating on the material ensures resistance to water entering from any direction. Secret/Hidden Pocket: An invisible zipper pocket on the edge of the back panel acts as a guard for any valuable items such as TWS/ Earbuds, Passport, Phone against theft. Multi-Level Organizer: The backpack has a front zipper pocket for the ID card, Sanitizer, House keys, Pen. First compartment with pockets for the earphones, pens, notebook, Fitness Band. Spacious second compartment for all your electronics. Ergonomic Design: Thick cushioning around the shoulders and on the back panel makes the backpack super light and comfortable on the move. “S” Shaped shoulder strap distribute the weight of the backpack across your upper body. Made In India: Mi Business Casual Backpack is fully manufactured in India and pass through stringent quality tests and checks 6 Months Warranty: The MI Business casual backpack comes with 6 months of warranty. For queries please reach out to 18001036286 Country of Origin: India",Brand: MI
https://www.amazon.in/Tabelito-NEO-Backpack-Business-Compartment/dp/B0C2D2GPWJ/ref=sr_1_96?crid=2M096C61O4MLT&keywords=bags&qid=1688660131&sprefix=ba%2Caps%2C283&sr=8-96,"Tabelito® NEO 3O L Water Resistant Laptop/College/Office/School/Travel/Business Bag, Unisex Backpack for Men Women Fits Up to 15.6 Inch Laptop Notebook.",₹399,4.3,79,B0C2D2GPWJ," Care Instructions: Hand Wash Only The front and side zipper compartments of the backpack make it simple to store items like tablets, diaries, pens, pencils, smartphones, cards, change and other small items. The backpack's side pockets make it easy to carry along tiny goods like mini umbrellas and water bottles. MADE IN INDIA - This ""MAKE IN INDIA"" laptop bag for men has 2 front zip pockets, 2 side bottle pockets, and 1 huge zipped section. For men, women, boys, and girls, this bag works great for the office, school, and college. In fact, it's the ideal all-purpose backpack for men, school bags for girls and boys, college bags for girls and boys and workplace bags for unisex LAPTOP BACKPACK SPECIFICATIONS - Men's NEO Laptop Backpack; Compartment Size: Up to 15.6 Inches. 30 litres is the capacity. 15 x 11.5 x 3 inches in size. NEO padded laptop backpack with internal organiser and sleeve that can handle up to 15.6"" laptops. Compatible laptops include those made by HP, Lenovo, Acer, ASUS, and Dell. Your keys, cords, office supplies, and other valuables can be neatly organised inside the organiser to avoid theft. The Tabelito Casual Backpack is entirely produced in India and goes through strict quality inspections and tests. Water Resistant Material: The material has an advanced IPX4 coating that prevents water from penetrating from any angle. The backpack features a 30L capacity and a padded laptop pocket that fits a 15.6 inch laptop. Additional necessities that can fit within are a lunchbox, charger, tablet, books, power bank, wallet, and sunglasses.",Brand: Tabelito 
https://www.amazon.in/DZert-Polyester-Black-White-Backpack/dp/B07GXX2BP3/ref=sr_1_97?crid=2M096C61O4MLT&keywords=bags&qid=1688660131&sprefix=ba%2Caps%2C283&sr=8-97,DZert Clasy Laptop Bag College Bag for Boys Girls 21 L Red Black,₹339,3.8,"2,461",B07GXX2BP3, Closure Type: Zipper; Strap Type: Adjustable; Age Range Description: Kid; Warranty Description: No Warranty; Style Name: Daypack Backpacks; Color Name: Blu-Wht; Water Resistance Level: Water Resistant,Brand: DZert 
https://www.amazon.in/Step-Backpack-Small-Water-Repellant/dp/B088XH1BP7/ref=sr_1_98?crid=2M096C61O4MLT&keywords=bags&qid=1688660131&sprefix=ba%2Caps%2C283&sr=8-98,"Mi Step Out 12 L Mini Backpack (Small Size, Dark Blue, Water Repellant)",₹249,4.1,"9,322",B088XH1BP7," Made of multi-coated 600D polyester Material ; Water Repellent Dimension: 38cm x 26cm x 14cm (LxWxH); Weight : 200 grams; Capacity: 12liters Small Size backpack; Laptop Compatibility: No This backpack comes with 2 zipper pockets that can house a notebook, gym gear, travel essentials and more With contra zippers and adjustable straps this light weight backpack is the ideal companion while at the airport or hitting the gym or exploring new city or using it as a carrier for books 6 months limited warranty",Brand: MI
https://www.amazon.in/Urban-Tribe-Laptop-Backpack-Havana/dp/B01LXNNFDF/ref=sr_1_99?crid=2M096C61O4MLT&keywords=bags&qid=1688660131&sprefix=ba%2Caps%2C283&sr=8-99,"URBAN TRIBE Havana Laptop Backpack for Men & Women | Laptop Bag 15.6 inch | Office Work/Casual/College Bag | Black, 27L",₹939,3.9,773,B01LXNNFDF," Laptop Compatibility: Yes, Laptop size: 15.6 inches Outer Material: Polyester, Color: Black Water Resistance: Water resistant Dimensions: 33 cms x 17.5 cms x 47 cms (LxWxH) Warranty type: Manufacturer; 12 months warranty against manufacturing defects",Brand: URBAN TRIBE 
https://www.amazon.in/Half-Moon-Laptop-Bag-Compartment/dp/B0C1NZLF67/ref=sr_1_100?crid=2M096C61O4MLT&keywords=bags&qid=1688660131&sprefix=ba%2Caps%2C283&sr=8-100,Half Moon Valex Unisex School Bag/Laptop Backpack/College Bagpack/Office Back Packed | Laptop Bag for Men & Women | School Bags for Boys & Girls with Small Pockets & Laptop Compartment,₹649,3.9,48,B0C1NZLF67," Trendy Design: The Laptop bag for men features a unique, trendy design that makes it stand out from other laptop backpacks. It's perfect for individuals who want to express their style while carrying their laptop. Secure Laptop Compartment: The 17-inch padded compartment in laptop backpack for men / Laptop bag for men provides secure storage for your device. The padding ensures that your laptop is protected from scratches and bumps while you're on the move. Front Pockets: The small pockets in College Bags for men / College bag for women in Second Compartment provide easy access to smaller items like your phone, wallet, and keys. These pockets are convenient and ensure that you don't have to dig through the main compartment to find what you need. Strong Built: The Laptop bag for men is built with strong zippers and stitching that can withstand daily wear and tear. This ensures that your belongings are kept safe and secure in college bag for girls and the backpack for men can hold up to daily use. Comfortable to Wear: The Laptop bag for men / backpack for men is designed for maximum comfort. The padded shoulder straps and back panel provide added comfort, reducing strain on your back and shoulders while carrying the laptop backpack. This makes it easy to wear the backpack for extended periods of time, whether you're commuting to work or school or going on a trip.",Brand: Half Moon 
https://www.amazon.in/sspa/click?ie=UTF8&spc=MTo2MjcyMDg0MzA3OTIxMzQ1OjE2ODg2NjAxMzE6c3BfYnRmOjIwMDIxNDI3OTc2NjA2OjowOjo&url=%2FKiller-Backpack-Compartments-Polyester-Waterproof%2Fdp%2FB07C9XHZT1%2Fref%3Dsr_1_101_sspa%3Fcrid%3D2M096C61O4MLT%26keywords%3Dbags%26qid%3D1688660131%26sprefix%3Dba%252Caps%252C283%26sr%3D8-101-spons%26sp_csd%3Dd2lkZ2V0TmFtZT1zcF9idGY%26psc%3D1,KILLER Louis 38L Large Laptop Backpack With 3 Compartments Polyester Trendy Waterproof Travel Backpack,"₹1,801",4.4,"11,394",B07C9XHZT1," Care Instructions: Hand Wash Only Outer Fabric: Durable PU coated Polyester Fabric. Inner Fabric: Strong PU coated polyester fabtic<br><br> Well cushioned Laptop compartment for upto 15.6 inch Laptop, and spacious enagh to carry for two days cloths<br><br> Style Name: Travel Backpacks; Pattern Name: Solid; Pocket Description: Utility Pocket; Age Range Description: Adult; Strap Type: Adjustable; Water Resistance Level: Water Resistant; Warranty Description: 1 Year Warranty Against Manufacturing Defects.; Compartment Description: Up To 15 Inches<br>",Brand: KILLER
https://www.amazon.in/sspa/click?ie=UTF8&spc=MTo2MjcyMDg0MzA3OTIxMzQ1OjE2ODg2NjAxMzE6c3BfYnRmOjIwMTIzNDg0NTE4MDk4OjowOjo&url=%2FHEROZ-Hammer-Durable-Travel-Laptop%2Fdp%2FB07MGDFT9C%2Fref%3Dsr_1_102_sspa%3Fcrid%3D2M096C61O4MLT%26keywords%3Dbags%26qid%3D1688660131%26sprefix%3Dba%252Caps%252C283%26sr%3D8-102-spons%26sp_csd%3Dd2lkZ2V0TmFtZT1zcF9idGY%26psc%3D1,HEROZ Hammer Unisex Nylon 45 L Travel Laptop Backpack Water Resistant Slim Durable Fits Up to 17.3 Inch Laptop Notebook (All) (Grey & Black),"₹1,499",4.3,"7,987",B07MGDFT9C," Warranty type: Manufacturer, 1 year domestic warranty<br> <br> Special Features: Laptop Compartment; Pocket Description: Utility Pocket; Age Range Description: Adult; Closure Type: Zipper Snap; Pattern Name: Solid; Warranty Description: 1. Year Manufacturer Warranty; Strap Type: Chain; Compartment Description: Greater Than 17 Inches <br>",Brand: HEROZ 
https://www.amazon.in/sspa/click?ie=UTF8&spc=MTo0ODcyNjYxMjM0NjU5MTcwOjE2ODg2NjAxMzQ6c3BfYXRmX25leHQ6MjAwMjIzMDUzNDYzMDY6OjA6Og&url=%2FCOSMUS-Polyester-Multi-functional-Convertible-15-6-Inch%2Fdp%2FB07D1R1K84%2Fref%3Dsr_1_97_sspa%3Fcrid%3D2M096C61O4MLT%26keywords%3Dbags%26qid%3D1688660134%26sprefix%3Dba%252Caps%252C283%26sr%3D8-97-spons%26sp_csd%3Dd2lkZ2V0TmFtZT1zcF9hdGZfbmV4dA%26psc%3D1,COSMUS Agility Convertible Backpack Messenger Bag Shoulder bag Laptop Case Handbag Business Briefcase Multi-functional Travel Bag Fits 15.6 Inch Laptop,"₹2,141",4.2,974,B07D1R1K84, 26L capacity : Weight: 950 gm Dimension: 17.5x12.5x7.5 inches<br><br> Warranty Description: 1 Year Warranty Against Manufacturing Defects.; Compartment Description: Up To 15 Inches; Water Resistance Level: Water Resistant; Closure Type: Zipper; Lining Description: Polyurethane; Pattern Name: Solid; Style Name: Travel Backpacks; Age Range Description: Adult; Special Features: Laptop Compartment<br> <br> <br> <br>,Brand: COSMUS 
https://www.amazon.in/sspa/click?ie=UTF8&spc=MTo0ODcyNjYxMjM0NjU5MTcwOjE2ODg2NjAxMzQ6c3BfYXRmX25leHQ6MjAxNjAyNDk1MDkyOTg6OjA6Og&url=%2Fuppercase-Professional-Anti-Theft-Overnighter-sustainable%2Fdp%2FB0C4PRDZ9X%2Fref%3Dsr_1_98_sspa%3Fcrid%3D2M096C61O4MLT%26keywords%3Dbags%26qid%3D1688660134%26sprefix%3Dba%252Caps%252C283%26sr%3D8-98-spons%26sp_csd%3Dd2lkZ2V0TmFtZT1zcF9hdGZfbmV4dA%26psc%3D1,uppercase Nexus Professional Anti-Theft Overnighter Travel Laptop Backpack,"₹2,500",5.0,10,B0C4PRDZ9X," Care Instructions: Wipe with Damp Cloth Handcrafted with care and made up of premium quality robust material. 3x more water resistant material with rainproof zippers and 2.5x more padded shoulder straps Anti-Theft design, Padded laptop compartment that can fit upto 15.6"" laptop along with a tablet sleeve Trolley sleeve at the back to secure your luggage, compression straps for the weekend packing GRS certified for sustainability; The GRS (Global Recycled Standard) is intended for use with any product that contains at least 50% Recycled Material (License No. CMPY-158596); 750 days of international warranty",Brand: uppercase 
https://www.amazon.in/WILD-MODA-Womens-Shoulder-Turquoise/dp/B099PLT91X/ref=sr_1_99?crid=2M096C61O4MLT&keywords=bags&qid=1688660134&sprefix=ba%2Caps%2C283&sr=8-99,"WILD MODA Women's Shoulder Bag, Set of 1",₹849,4.2,"3,966",B099PLT91X," Ample Compartments : The handbag will fulfil all your storage needs with its 3 big compartments and 6 pockets having a capacity of holding 20L of weight. The spacious compartments can keep all your stuff from your ipad, and smartphone to your kid’s diapers or your makeup kit and the side pocket can keep your water bottle or umbrella and take them out anytime without the need of opening and closing the zipper lock every time. High-quality Polyester : he stylish bag is constructed in premium quality waterproof polyester material which makes it a durable option. You can carry all your stuff with ease as the high-quality material of the bag ensures no breakage or damage to the bag due to weight. The waterproof material saves all your stuff from getting wet and the imported quality zippers ensure that they will not break or lose their shine even after continuous usage. Soft Fabric : As the bag's fabric is so comfortable to the touch, carrying it won't bother you. The shoulder straps of the bag are made from extra soft material which makes sure that the straps do not cause any itching or irritation even after continuous usage. So, you don't have to be concerned about the straps hurting your shoulders. Classy and Stylish : The solid finish of the bag gives it a dash of style and class. You can take it anywhere from parties to the office and the bag will be your best style buddy everywhere. No matter if you are an office-going girl or a college girl, you can make a style statement with this bag. Every girl's wardrobe needs this bag because of its flawless finish, which elevates it to must-have status. Light Feel : Even with all of your belongings inside this high-quality bag, which weighs only 400 grams and won't add to your burden when carried, you'll feel light. The shoulder straps of the bag make sure that it rests perfectly on your shoulders and you don't feel too much weight ensuring that even after carrying the bag for hours, your shoulders won't feel any pain on your shoulders. Warranty: 6 months domestic warranty on manufacturing defects, Covered in Warranty: Zippers & Sliders, Not Covered in Warranty:Cloth Material, Care Instructions: Do not expose to extreme heat",Brand: WILD MODA 
https://www.amazon.in/Capriff-Liters-Collage-travell-Backpack/dp/B084T7X2HX/ref=sr_1_100?crid=2M096C61O4MLT&keywords=bags&qid=1688660134&sprefix=ba%2Caps%2C283&sr=8-100,CAPRIFF 32 L Casual Waterproof Laptop Bag/Backpack for Men Boys & Girls For Office School College Teens & Students with Rain Cover With adjustable Strap With 2 Compartment,₹539,3.8,"3,081",B084T7X2HX," Care Instructions: Hand Wash Only Capacity: 35Litres; Quality: best quality as it is perfectly designed and made from high quality lightweight nylon and double dotted waterproof polyester.<br> <br> This backpack is made to used for boys, girls, men, women and kids. This bag is very good for boys and girls of age because it has enough space to carry all books and accessories and it is very comfortable and stylish.<br> <br> Two Main Compartment And One Extra Compartment Offers Space For Magazines, Notepad,Other Laptop Accessories, Stationery items || Eco-friendly, Durable, Lightweight, Flexible And Star Water-Resistant Material Helps To Keep The Interior Dry with a high quality material that keep Dust away.<br> <br> Closure Type: Zipper; Strap Type: Shoulder Strap; Age Range Description: Adult; Compartment Description: Greater Than 17 Inches <br>",Brand: CAPRIFF 
https://www.amazon.in/Police-Polyester-laptop-casual-backpack/dp/B09CQ5T3LN/ref=sr_1_101?crid=2M096C61O4MLT&keywords=bags&qid=1688660134&sprefix=ba%2Caps%2C283&sr=8-101,POLICE Backpack for Men Casual Laptop Bag Office/Travel/College 30 Ltr Hedge Polyester - Black,"₹1,399",4.1,"5,656",B09CQ5T3LN, Care Instructions: Hand Wash Only Backpack,Brand: POLICE 
https://www.amazon.in/Capacity-Lightweight-Waterproof-Multifunctional-Shoulder/dp/B0C24P2HD9/ref=sr_1_102?crid=2M096C61O4MLT&keywords=bags&qid=1688660134&sprefix=ba%2Caps%2C283&sr=8-102,"Large Capacity Folding Travel Bag, Travel Lightweight Waterproof Carry on Luggage Bags, Multifunctional Sports Shoulder Bag, Foldable Travel Duffel Bag (Blue)",₹479,4.5,17,B0C24P2HD9," Foldable bags are designed to be easily collapsible and compact, making them convenient for storage and transport when not in use. They are perfect for people who are always on the go and need a bag that is easy to carry and store. These bags are typically made from lightweight and durable materials such as nylon, polyester or canvas. This makes them strong enough to carry a variety of items, while also being lightweight enough to not add too much extra weight to your load. One of the most appealing features of foldable bags is their ability to be folded into a small and compact size. They can be folded up into a small package that is often small enough to fit in a pocket or purse, making them easy to carry around wherever you go. Most foldable bags come with handles for carrying, and some may have a shoulder strap as well. This allows you to carry the bag comfortably, whether you are using it to carry groceries or as a day bag for traveling. Foldable bags come in a range of colors and designs, making them both practical and stylish. You can choose from a variety of colors and patterns to suit your personal style, and many brands offer different sizes and shapes to accommodate different needs.",Brand: CristaVista
https://www.amazon.in/STRABO-Cooper-Laptop-Bag-Capacity/dp/B0BX9SVT1D/ref=sr_1_103?crid=2M096C61O4MLT&keywords=bags&qid=1688660134&sprefix=ba%2Caps%2C283&sr=8-103,"STRABO Cooper for Boys Girls Stylish Men and Women Casual 15"" inch 25L CANVAS Laptop BACKPACK | Office, College, Travel Bag",₹699,4.3,40,B0BX9SVT1D, One Main compartment and Laptop Compartment with front pocket & 2 side bottle sleeves Dimensions 45 x 32 x 17 cm Capacity 20L Premium YKK zippers,Brand: STRABO
https://www.amazon.in/House-Quirk-Maternity-Backpack-Elephant/dp/B07QV7SH4S/ref=sr_1_104?crid=2M096C61O4MLT&keywords=bags&qid=1688660134&sprefix=ba%2Caps%2C283&sr=8-104,House of Quirk Baby Diaper Bag Maternity Backpack (Blue Elephant Printed),"₹1,399",4.3,"3,791",B07QV7SH4S," DURABLE MATERIAL:Diaper bags made of environmental and durable oxford material,water resistant and easy to wipe clean, strong zippers,you'll have a diaper backpack that lasts for years. LARGE CAPACITY: Dimension L x W x H 41 x 18 x 25.5 cm, 16.1"" x 7.0"" x 10.0"" inch,it is very roomy and contains individual functional pockets, can hold all your essential items for baby care,such as baby diaper,milk bottle towel,water bottle, changing pad,snacks. MULTI FUNCTION: You can use this bag as backpack and handbag. It is very elegant and suitable for many occasion like shopping, traveling etc. A fashionable backpack that can be carried by moms and dads alike. WELL-DESIGNED:Wet and Dry Separation design,don't worry for baby's wet cloth, you can put the wet cloth in the separated inner pocket,A zipper in the back of the bag can be opened for easy access,wide mouth design top opening can offer you a large view. BEST GIFT IDEA:Perfect baby shower gift for a special new Mommy,we designed a compact diaper backpack that combines style, versatility and convenience.suitable for many occasions like shopping, restaurant, traveling etc.Great for a wedding gift,business gift,New mother gift,holiday gift etc.",Brand: House of Quirk 
https://www.amazon.in/DZert-Polyester-Pink-School-Backpack/dp/B077VFZHLL/ref=sr_1_105?crid=2M096C61O4MLT&keywords=bags&qid=1688660134&sprefix=ba%2Caps%2C283&sr=8-105,DZert School Bag Backpack 30 Liters for Boys/Girls Polyester Lightweight Bag (Pink),₹319,3.6,"1,897",B077VFZHLL," Padded ergonomic shoulder straps for ultimate comfort. Exterior side beverage accessory holder Two compartment backpack Sleeve for long books school bag with big spaces Students can also fill all types of school books lunch box and water bottle bags 2 Chamber With Zip 1 Side Bottle Pocket. School Bag, Backpack, Travelling Bag, Carry Bag, Picnic Bag",Brand: DZert 
https://www.amazon.in/Glowic-Unisexs-Backpack-College-Students/dp/B0BGX9W69N/ref=sr_1_106?crid=2M096C61O4MLT&keywords=bags&qid=1688660134&sprefix=ba%2Caps%2C283&sr=8-106,Glowic Unisex's Backpack for Men Women Boys Girls/Office School College Teens & Students (WBAG-64) (Black),₹899,3.6,218,B0BGX9W69N," Closure: Zipper Material Type : Canvas Weight : 450 Gm , Dimensions : 30 x 40 x 14 cm (LxHxW); Water Resistance : no Special Features : Classic Fashion Style, Multi-Pockets, easily carry your mobile phone, tablet, wallet, cosmetic, water bottle, umbrella and other daily items. This women's casual backpack is a perfect gift for her on Birthdays, Anniversaries, Christmas Day, Valentine's Day to show your care. (Please note : Bag is small in size please check dimension before placing order & Color match may be up/down due to photographic effect) Pattern Name: Solid; Pocket Description: Utility Pocket; Special Features: Laptop Compartment; Closure Type: Zipper; Lining Description: Cotton Outer Material: Canvas; Inner Material: Polyester; Product: Made in India",Brand: Glowic 
https://www.amazon.in/sspa/click?ie=UTF8&spc=MTo0ODcyNjYxMjM0NjU5MTcwOjE2ODg2NjAxMzQ6c3BfbXRmOjMwMDAwNzE1ODc3NzYzMjo6MDo6&url=%2FRed-Lemon-Backpack-Travelling-Weekender%2Fdp%2FB0B9X2BLDF%2Fref%3Dsr_1_107_sspa%3Fcrid%3D2M096C61O4MLT%26keywords%3Dbags%26qid%3D1688660134%26sprefix%3Dba%252Caps%252C283%26sr%3D8-107-spons%26sp_csd%3Dd2lkZ2V0TmFtZT1zcF9tdGY%26psc%3D1,"Red Lemon BANGE Cyborg Laptop Backpack for Men Business Travelling Backpack with USB Charger Port,Weekender Carry-On laptop bag for men","₹3,799",4.1,50,B0B9X2BLDF," Care Instructions: Hand Wash Only TRAVEL BACKPACK WITH USB CHARGING PORT:Built-in USB charging cable, more convenient to carry, and you don't need to worry about lower battery for your phone. Charge to your phone anytime and anywhere. <br> DURABLE AND WATERPROOF WEEKENDER BACKPACK: BANGE backpack is made of high quality water resistant Oxford cloth. It is durable and anti-scratch. It's your best partner in your casual use. <br> LIGHTWEIGHT AND COMFORTABLE MEN BACKPACK:Very light weight to carry. Shoulder strap and back are made of breathable mesh padded that can provide you all day comfort.; MULTI STORAGE POCKETS:Front side pocket is convenient for various small items. Large compartment is great for 15.6"" laptop?camera?power bank?water bottle?Notebook?pens. <br> ULTIMATE CUSTOMER SERVICE: Every travel backpack was passed multiple strict quality control. But if you have any problems, please feel free to contact us, we provide Lifetime Warranty Service. <br> Pattern Name: Solid; Style Name: Travel Backpacks; Age Range Description: Adult; Lining Description: Polyester; Closure Type: Zipper <br>",Brand: Red Lemon 
